Produk,Nama,Waktu,Review,Rating
Lenovo IdeaPad Gaming 3 15ACH6 Ryzen 5 5500H 8 512 RTX 2050 4GB W11OHS,k***f,Hari ini,design mewah dan terasa ringan👍,bintang 5
Lenovo IdeaCentre 5 14IRB8 Core i5-13400 8GB 512GB W11 OHS,A***i,1 hari lalu,"Jelas, responsif, cepat deliverynya",bintang 5
"Monitor LED LENOVO L24i-40 24"" IPS 1080p 100Hz VGA HDMI Speaker ,VESA",M***M,1 hari lalu,"Mantap dan sesuai kebutuhan. Semoga awet agr tak perlu pakai garansi. Tks, sukses sll",bintang 5
Lenovo IdeaPad Pro 5 14IRH8 Core i7-13700H 16GB 1TB RTX 3050 6GB,Putri,1 hari lalu,Spesifikasi dan fitur sangat baik,bintang 5
Lenovo IdeaPad Slim 3i 14IAU7 Core i3-1215U 8GB 512GB W11 OHS,Muhamad,1 hari lalu,"Sangat sesuai deskripsi, semoga awet 🌟🌟 🌟 🌟 🌟",bintang 5
Lenovo IdeaPad Slim 3 14ABR8 Ryzen 5 7530U 8GB 512GB W11 OHS,Aulia,1 hari lalu,"dikasih bonus tas & mouse 👌🏻
terima kasih",bintang 5
"Lenovo Monitor Legion R25i-30 24.5"" IPS 165Hz",Gilang,1 hari lalu,Gilaaa dari semua part ini yang paling saya suka gatau kenapa ngerasa ga nyesel beli ini dan bersyukur banget ketemu monitor ini,bintang 5
Lenovo V14 G3 IAP Core i3-1215U 8GB 256 W11+OHS,Faizal,2 hari lalu,ok,bintang 5
"Lenovo Monitor L22e-40 21.5"" VA 75 Hz",Aliot,2 hari lalu,"CAKEP BANGET 👍👍
Seller fast respon and helpfull banget.
Deliverynya juga cepet banget..👍👍
Bakal RO disini. 🫰",bintang 5
Lenovo V14 G4 AMN Athlon Silver 7120U 8GB 256GB W11 OHS,N***o,2 hari lalu,Layar tipis Tampilannya keren 👍 Desainnya simpel Warnanya kece Packaging aman 🙏,bintang 4
Lenovo IdeaCentre AIO 3 24IAP7 Core i7-13620H 8GB 512GB MX550 W11 OHS,T***y,3 hari lalu,"pengiriman cepat, barang bagus",bintang 5
Lenovo IdeaPad Slim 3i 14IAU7 Core i3-1215U 8GB 512GB W11 OHS,Slamet,3 hari lalu,"Admin Seller responsif, proses dan pengiriman cepat, Laptop dan Bonus diterima lengkap dan berfungsi dengan baik.. semoga awet",bintang 5
Lenovo V14 G3 IAP Core i5-1235U 8GB 512GB W11 OHS,Y***s,3 hari lalu,Recommended laptop for office usage 👍👍,bintang 5
Lenovo ThinkBook 14 G3 ACL Ryzen 3 5300U 4GB 512GB SSD W11+OHS,Tri,3 hari lalu,thanks lenovo... pakingannya bagus dan aman,bintang 5
Lenovo ThinkBook 14 G3 ACL Ryzen 3 5300U 4GB 512GB SSD W11+OHS,D***i,3 hari lalu,"Product Sesuai Deskripsi, berfungsi dengan baik, pengiriman cepat dan kemasan aman, Recommended Seller",bintang 5
Lenovo IdeaPad Slim 3i 14IAU7 Core i3-1215U 8GB 512GB W11 OHS,J***e,4 hari lalu,Sejauh ini okee,bintang 4
"Lenovo Monitor Legion R27q-30 27"" IPS 165Hz",Fauzil,4 hari lalu,"Monitornya sangat bagus buat game, performanya oke dan tampilan elegan 
Adminnya fast respon, dan menjawab pertanyaan dengan baik dan sabar",bintang 5
"Lenovo Monitor Legion R25i-30 24.5"" IPS 165Hz",Gilang,4 hari lalu,"Pengirimannya bener bener cepet dan aman, pake instant langsung diproses

Monitor ya bener bener diatas ekspektasi, speakernya lumayan juga buat gantiin speaker laptop",bintang 5
Lenovo V14 G4 AMN Ryzen 5 7520U 8GB 512GB W11 OHS,hari,5 hari lalu,"Pengiriman cepat kurang dari 30 jam sdh tiba(walau harus ngambil ke kantor kurir), packing mantap worth it bgt harganya, cs fast respon, cuma agak kesal aja kenapa gak se... ",bintang 5
SCREEN PROTECTOR LAPTOP,hari,5 hari lalu,"Mantap terpasang, pengiriman cepat(walau harus diambil sendiri), FAST respon👍",bintang 5
Lenovo Lenovo V14 G3 IAP Core i3-1215U 8GB 512GB W11 OHS,Arif,5 hari lalu,"mantap, packing safe banget,",bintang 5
"Lenovo Monitor Legion R27q-30 27"" IPS 165Hz",D***o,5 hari lalu,"Monitor 2k 165hz paling worth saat ini, akurasi layar oke dipake main game juga oke. Sementara via laptop dlu sambil nabung PC. credits @GTid

admin lenovo official sanga... ",bintang 5
Lenovo IdeaPad Slim 3 14IAH8 i5-12450H 16GB 512GB W11 0HS,R***d,5 hari lalu,Barang sesuai deskripsi & pengiriman cepat.,bintang 5
Lenovo IdeaPad Duet 3i 11IAN8 Intel N200 8GB 256GB W11+OHS Touch,K***a,6 hari lalu,"Sudah sampai dengan selamat, packing kayu paling aman sampai 2hr tidak ada kendala saat paket di unboxing, spek cocok untuk para pelajar dgn win 11 , garansi brg 2th, pen... ",bintang 4
Lenovo IdeaPad Slim1 14IGL7 Celeron N4020 8GB 256 SSD W11 OHS,H***i,6 hari lalu,baguuus banget. pengirimannya aman sampaii rumah. laptopnya juga ringan banget 😍 dapet free tas sama mouse jugaaak 👍👍,bintang 5
Lenovo Lenovo V14 G3 IAP Core i3-1215U 8GB 512GB W11 OHS,Gun,6 hari lalu,Alhamdulillah...,bintang 5
"Monitor LED LENOVO L24i-40 24"" IPS 1080p 100Hz VGA HDMI Speaker ,VESA",Suartana,6 hari lalu,barang sampai dengan selamat kualitas bagus dan berfungsi dengan baik. mudah-mudahan awet. terima kasih,bintang 5
"Lenovo Monitor Legion R27q-30 27"" IPS 165Hz",w***i,1 minggu lalu,"sudah sampai, cepat, kemarin pesan dan hari ini sampai. belum dicoba karena ngga include kabel hdmi, dapetnya kabel displayport tapi dari toko katanya sudah dicek untuk d... ",bintang 5
Lenovo IdeaPad Slim 3i 14IAU7 Core i3-1215U 8GB 512GB W11 OHS,N***a,1 minggu lalu,Kualitasnya sangat bagus pas banget buat kerjaaa,bintang 5
"Lenovo Monitor Legion R27q-30 27"" IPS 165Hz",G***g,1 minggu lalu,waw,bintang 5
Lenovo Digital Pen,a***n,1 minggu lalu,berfungsi dengan baik,bintang 5
Lenovo IdeaPad Slim3i 14IAU7 Core i3-1215U 8GB 256SSD Win11 OHS,Febry,1 minggu lalu,"Barang sesuai deskripsi, penjual fast respon",bintang 5
"Lenovo Monitor Legion R25i-30 24.5"" IPS 165Hz",Edward,1 minggu lalu,"Monitor paling bagus, kokoh, sRGB beneran bukan tipu2. Terbaik pokoonya",bintang 5
Lenovo LOQ 15IRH8 Core i5-13420H 8GB 512GB RTX4050 6GB W11+OHS,Aviantara,1 minggu lalu,"keren banget dah, seller respon cepat dan di packing aman banget",bintang 5
"Lenovo Monitor Legion R25i-30 24.5"" IPS 165Hz",Abu,1 minggu lalu,oke,bintang 5
Lenovo ThinkBook 14 G3 ACL Ryzen 3 5300U 4GB 512GB SSD W11+OHS,Satya,1 minggu lalu,"Sat set, barang oke, bonus juga oke. Semoga awet! Terima kasih Lenovo Indonesia",bintang 5
Lenovo ThinkPad E14 Gen 5 (Intel) Core i3-1315U 8GB 512GB W11Pro,A***s,1 minggu lalu,"Terimakasih , barang sampai dengan aman mungkin kurirnya JNT lama",bintang 5
Lenovo IdeaPad Slim 3i 14IAU7 Core i3-1215U 8GB 512GB W11 OHS,A***h,1 minggu lalu,"Dapat free mouse, sangat memuaskan",bintang 5
Lenovo Yoga 7 14ARP8 Ryzen 7 7735U 16GB 1TB W11 OHS,A***a,1 minggu lalu,baguss seller responsif semoga awett,bintang 5
SCREEN PROTECTOR LAPTOP,A***a,1 minggu lalu,jujur klo diperhatiin bgtt agak kurang ngepas masangnya tp gpp ga begitu mengganggu kok thanks,bintang 4
Lenovo IdeaPad Slim 3i 14IAU7 Core i7-1255U 8GB 512GB W11 OHS,Marlina,1 minggu lalu,"order kesekian kalinya... prngiriman sangat cepat, seller sangat responsif",bintang 5
Lenovo IdeaCentre AIO 3 24IAP7 Core i3-1215U 8GB 512GB W11 OHS,F***r,1 minggu lalu,"gokil cepet banget, udh dicoba set up. semoga awet, cukup banget utk keperluan kerjaan ringan di kantor cabang gw yang baru",bintang 5
"Monitor LED LENOVO L24i-40 24"" IPS 1080p 100Hz VGA HDMI Speaker ,VESA",Fahimul,1 minggu lalu,"pakai cargo cepat seperti reguler, barang mantap semoga awet",bintang 5
Lenovo ThinkPad T14 Gen 4 (Intel) Core™ i7-1355U 32GB 1TB W11Pro,ACI,1 minggu lalu,"Langganan. pelayanan selalu OK, fast response, pengiriman cepat  & aman",bintang 5
Lenovo ThinkPad E14 Gen 5 (Intel) Core i7-1355U 16GB 512GB W11Pro,Toni,1 minggu lalu,Fast responsent,bintang 5
Lenovo V14 G4 AMN Ryzen 5 7520U 8GB 512GB W11 OHS,S***i,1 minggu lalu,barangnya ok pengiriman cepat dan respon penjual cepat thanks ya,bintang 5
Lenovo IdeaPad Slim1 14IGL7 Celeron N4020 8GB 256 SSD W11 OHS,Dimas,1 minggu lalu,"Pengiriman cepat, safe ti pakek kayu leptop nya lancar tidak ada kendala mantap 👍🏻",bintang 5
"Monitor LED LENOVO L24i-40 24"" IPS 1080p 100Hz VGA HDMI Speaker ,VESA",Purwanto,1 minggu lalu,"Mantap bagus, gercep yg jual. Cuma monitor nya nggak bisa dipendekin, tapi bisa dimiringin si...",bintang 5
Lenovo ThinkBook 14 G4 IAP Core i7-1255U 16GB 512GB MX550 2GB W11+OHS,D***i,1 minggu lalu,"Produk sesuai deskripsi, pengiriman cepat kemasannya aman, recommended seller.",bintang 5
"Lenovo Monitor G34w-30 VA 34""",Dinan,2 minggu lalu,"Mantap, Monitornya sesuai dengan yg di deskripsi, recommended curved monitor",bintang 5
Lenovo IdeaPad Slim1 14IGL7 Celeron N4020 8GB 256 SSD W11 OHS,Irfan,2 minggu lalu,Gila sih ini. amanah banget. sellernya Selalu Respon . Barangnya bagus ga ada minus. pengiriman Cepat Banget. Mantapp,bintang 5
Lenovo ThinkBook 14 G6 IRL Core i5-1335U 8GB 512GB W11 OHS,I***n,2 minggu lalu,"Respon cepat, brg sesuai.",bintang 5
Lenovo IdeaPad Slim1 14AMN7 Ryzen 3 7320U 8GB 512GB SSD W11 OHS,M***a,2 minggu lalu,seller gercep dan barang 100% mulus bekerja dgn baik,bintang 5
Lenovo Lenovo V14 G3 IAP Core i3-1215U 8GB 512GB W11 OHS,m***y,2 minggu lalu,"Respon sangat cepat, barang tiba dengan aman dan berfungsi dengan baik. Seller very responsive and helpful. Highly recommended!",bintang 5
Lenovo LOQ 15IRH8 Core i5-12450H 8GB 512GB RTX 3050 6GB W11 OHS,P***u,2 minggu lalu,"Respon seller sangat baik. Barang juga mulus. Overall, 100% puas",bintang 5
Lenovo IdeaPad Slim1 14IGL7 Celeron N4020 8GB 256 SSD W11 OHS,E***y,2 minggu lalu,Mantap,bintang 5
Lenovo Yoga Slim 7 Carbon 13IRP8 Core i7-1360P 16GB 1TB W11+OHS,Adi,2 minggu lalu,Alhamdulillah thin n light 🤲🏼 mantap packing kayu + bubble wrap tebal + banyak aksesoris,bintang 5
Lenovo IdeaPad Slim 1 14IGL7 Celeron N4020 8GB 512GB W11 OHS,art,2 minggu lalu,"terima kasih kak.. disaat laptop adek rusak butuh urgent, langsung dikirim juga.. over all laptop berjalan dengan baik",bintang 5
Lenovo ThinkBook 14 G3 ACL Ryzen 3 5300U 4GB 512GB SSD W11+OHS,indah,2 minggu lalu,"Alhamdulillah akhirnya sampai... Puas, bagus dan sesuai ekspektasi.. hadiahnya jg 👍",bintang 5
"Lenovo Monitor Legion R25i-30 24.5"" IPS 165Hz",Nova,2 minggu lalu,"keren barangnya, fast respon and dikirim dengan selamat",bintang 5
"Lenovo Monitor ThinkVision M15 15.6"" IPS 60Hz",denny,2 minggu lalu,good deal super fast shipping,bintang 5
Lenovo Yoga 7 14ARP8 Ryzen 7 7735U 16GB 1TB W11 OHS,N***a,2 minggu lalu,"Produk dikirim dengan cepat dan dipaket dengan baik sekali. Seller nya recommended. Laptopnya, setup mudah dan memang untuk keperluan saya Lenovo YOGA 7 Ryzen ini sejauh... ",bintang 5
Lenovo V15 G3 IAP i3-1215U 8GB 512GB W11 OHS,D***s,2 minggu lalu,Barang sesuai pesanan semoga awet,bintang 5
Lenovo LOQ 15IAX9I Core i5-12450HX 8GB 512GB Intel Arc A530M 4GB,thoe,2 minggu lalu,"ok, cuma pengirimannya agak lama, tapi semua ok, packing ok, barang ok, bonus juga ok, bonus semuanya berkelas, thx ya",bintang 5
Lenovo IdeaPad Pro 5 16APH8 Ryzen 7 7840HS 16G 1TB RTX 3050 6GB W11OHS,Heri,2 minggu lalu,"team costumer servicenya sat-set banget, responsif n makasih bonusnya",bintang 5
"Lenovo Monitor Legion R27q-30 27"" IPS 165Hz",Grook,2 minggu lalu,Dapat yang perfect.,bintang 5
Lenovo Lenovo V14 G3 IAP Core i3-1215U 8GB 512GB W11 OHS,Tony,2 minggu lalu,Barang Bagus,bintang 5
"Lenovo Monitor Legion R25i-30 24.5"" IPS 165Hz",Farhan,2 minggu lalu,"ini versi downgrade resolusi dari r27q-30. semua fitur hampir sama, buat yg VGA pas Pasan rata kanan di 1080p ini udh bagus bgt, beda lagi kalo pke yg 2k pas full screen... ",bintang 5
"Lenovo Monitor G34w-30 VA 34""",S***o,2 minggu lalu,Mantap sekali,bintang 5
"Lenovo Monitor G34w-30 VA 34""",Billy,2 minggu lalu,"Monitor sampai dgn selamat. Berfungsi dgn baik.
Respon jg cepat dan bs pengiriman instant. 👍👍👍",bintang 5
Lenovo IdeaCentre AIO 3 24IAP7 Core i3-1215U 8GB 512GB W11 OHS,J***y,2 minggu lalu,oke,bintang 5
Lenovo LOQ 15IRH8 Core i5-12450H 8GB 512GB RTX 3050 6GB W11 OHS,F***i,2 minggu lalu,"barang sesuai, pengiriman cepat",bintang 5
Lenovo LOQ 15APH8 Ryzen 5 7640HS 8GB 512GB RTX 3050 6GB W11 OHS,Yunul,2 minggu lalu,"mantap pelayanan dan laptopnya udah pasti tak diragukan lagi spec dan kualitasnya. top

thanks bonus payungnya the besttt",bintang 5
Lenovo ThinkBook 14 G3 ACL Ryzen 3 5300U 4GB 512GB SSD W11+OHS,Aji,2 minggu lalu,performa mantap sesuai spesifikasi,bintang 5
Lenovo Digital Pen,Ratnasari,2 minggu lalu,works properly,bintang 5
Lenovo IdeaPad Slim 3i 14IAU7 Core i3-1215U 8GB 512GB W11 OHS,R***l,2 minggu lalu,Semoga awet,bintang 5
Lenovo IdeaCentre Mini 01IRH8 Core i7-13700H 8GB 512GB TANPA MONITOR,P***a,2 minggu lalu,Kualitas OK dan Full Power. Semoga Awet ya,bintang 5
Lenovo IdeaPad Slim1 14IGL7 Celeron N4020 8GB 256 SSD W11 OHS,Anggi,2 minggu lalu,mantap barangnya sesuai .,bintang 5
"Lenovo Monitor Legion R25i-30 24.5"" IPS 165Hz",H***o,2 minggu lalu,sejauh ini aman  gaditemuin dead pixel... menunggu GTID review aja,bintang 5
Lenovo LOQ 15APH8 Ryzen 5 7640HS 8GB 512GB RTX 4050 6GB W11+OHS,Ahmad,2 minggu lalu,"Mantab, tinggal update2 aja",bintang 5
Lenovo ThinkBook 14 G6 IRL Core i5-1335U 8GB 512GB W11 OHS,A***I,2 minggu lalu,Baterenya tahan lama Desainnya simpel Performanya mantap Layar tipis Warnanya kece Tampilannya keren 👍 Proses pesanan cepat Memory-nya besar Penjualnya ramah banget Pack... ,bintang 5
Lenovo ThinkPad E14 Gen 5 (Intel) Core i3-1315U 8GB 512GB W11Pro,ACI,2 minggu lalu,Baterenya tahan lama Desainnya simpel Layar tipis Performanya mantap Tampilannya keren 👍 Memory-nya besar Warnanya kece Packaging aman 🙏 Proses pesanan cepat Penjualnya... ,bintang 5
Lenovo IdeaPad Slim 3i 14IAU7 Core i3-1215U 8GB 512GB W11 OHS,Lulu,3 minggu lalu,"adminnya responsif, barang sampai dengan aman",bintang 5
Lenovo LOQ 15IRH8 Core i5-13420H 8GB 512GB RTX4050 6GB W11+OHS,Harsfaujan,3 minggu lalu,barang sampai dengan selamat dan berfungsi baik kelengkapan tas dan mouse juga dapet,bintang 5
"Lenovo Monitor Legion R27q-30 27"" IPS 165Hz",Eka,3 minggu lalu,"Setelah order ditelpon pihak seller untuk konfirmasi cek barang, pengiriman sudah include packing kayu (entah kalo lain waktu kebijakan mereka berubah). Alhamdulillah ama... ",bintang 5
Lenovo Yoga Slim 7 Pro 14ARH7 Ryzen9 6900HS CreatorEdition 16GB 1TB,Abdullah,3 minggu lalu,"Mantap
Menyala abangkuh 🔥🔥",bintang 5
Lenovo Legion Go 8APU1 Ryze Z1 Extreme 16GB 512GB W11 Touch,A***i,3 minggu lalu,"keren, pengiriman cepat, admin inisiatif kasih tau barangnya walaupun PO, de best lah",bintang 5
Lenovo Legion Go 8APU1 Ryze Z1 Extreme 16GB 512GB W11 Touch,nabila,3 minggu lalu,👍👍👍👍👍,bintang 5
Lenovo LOQ 15IRX9 Core i5-13450HX 8GB 512GB RTX 4050 6GB W11 OHS,I***a,3 minggu lalu,"Admin responsif dan informatif, barang sampai dengan selamat ditujuan, packing oke tidak ada yg penyok2, dapet bonus tas dan payung. Laptop oke banget buat yg kerjaannya... ",bintang 5
Lenovo LOQ 15IRX9 Core i7 13650HX 8GB 512GB RTX 4050 6GB W11 OHS,Alif,3 minggu lalu,Mantapp,bintang 5
Lenovo Yoga 7 14IRL8 Core i7-1360P 16GB 1TB W11+OHS,Mila,3 minggu lalu,"Produk bagus, keren banget, pengiriman cepat. Terima kasih dan sukses terus ya.",bintang 5
Lenovo IdeaPad Flex 5 14IRU8 Core i5-1335U 16GB 512GB W11+OHS,Bayu,3 minggu lalu,"Mantap , produk original, semua aman gak ada kendala, maaf ga ada foto soalnya dikirim untuk adik di kampung,, pelayanan sangat memuaskan,🙏",bintang 5
Lenovo IdeaPad Slim 5 14ABR8 Ryzen 5 7530U 16GB 512GB W11+OHS,Nina,3 minggu lalu,"CS nya cepat responnya. Pengiriman aman sekali. Dan kurirnya juga amanah, inisiatif nanya mah diskmoen depan rumaha atau di satpam. 

Laptopnya keren euuuy. Super worthed... ",bintang 5
Lenovo IdeaPad Pro 5 14IRH8 Core i7-13700H 16GB 1TB RTX 3050 6GB,Alfa,3 minggu lalu,thx unt cashback 1 mio,bintang 5
